<?xml version="1.0" encoding="utf-8" standalone="yes"?>

<!-- VolumeObject specification file                                        -->
<!--                                                                        -->
<!-- FORMAT:XML                                                             -->
<!--                                                                        -->
<!-- NO C-style comments                                                    -->
<!--                                                                        -->
<!-- CURRENTLY SUPPORTED CLASSES:                                           -->
<!--                                                                        -->
<!-- BoundingCylinder                                                       -->
<!-- Specifies a cylinder of a given depth, 								-->
<!-- the top disc centred at the coordinate <origin>.  						-->
<!-- BoundingCylinders have impenetrable surfaces and do not affect         -->
<!-- the growth rate of root tips growing within them.                      -->
<!--<rootmap
        xmlns="https://example.org/ROOTMAP/VolumeObjectsSchema"
        xmlns:xsi="http://www.w3.org/2001/XMLSchema-instance"
        xsi:schemaLocation="https://example.org/ROOTMAP/VolumeObjectsSchema https://rootmapstorageaccount.blob.core.windows.net/rootmap-schemata-container/VolumeObjects.xsd">
  <construction>
    <owner>VolumeObjectCoordinator</owner>
    <volumeobject>
      <class_name>BoundingCylinder</class_name>
      <origin>5.0,5.0,0</origin>
      <depth>50.0</depth>
      <radius>5.0</radius>
    </volumeobject>
  </construction>
</rootmap>                                                                  -->
<!-- BoundingRectangularPrism                                               -->
<!-- Specifies a right cuboid defined by two points, the left front top     -->
<!-- and right back bottom coordinates. Aligned with the Z-axis             -->
<!-- in the same way as BoundingCylinders.                                  -->
<!-- BoundingRectangularPrisms have impenetrable surfaces and do not affect -->
<!-- the growth rate of root tips growing within them.                      -->
<!--  <rootmap
        xmlns="https://example.org/ROOTMAP/VolumeObjectsSchema"
        xmlns:xsi="http://www.w3.org/2001/XMLSchema-instance"
        xsi:schemaLocation="https://example.org/ROOTMAP/VolumeObjectsSchema https://rootmapstorageaccount.blob.core.windows.net/rootmap-schemata-container/VolumeObjects.xsd">
    <construction>
     <owner>VolumeObjectCoordinator</owner>
     <volumeobject>
        <class_name>BoundingRectangularPrism</class_name>
       <leftfronttop>0,0,0</leftfronttop>
       <rightbackbottom>16,1,120</rightbackbottom>
      </volumeobject>
   </construction>
  </rootmap>
		<leftfronttop>1.9,1.9,1.9</leftfronttop>
		<rightbackbottom>4,4,6</rightbackbottom>
-->

<rootmap
        xmlns="https://example.org/ROOTMAP/VolumeObjectsSchema"
        xmlns:xsi="http://www.w3.org/2001/XMLSchema-instance"
        xsi:schemaLocation="https://example.org/ROOTMAP/VolumeObjectsSchema https://rootmapstorageaccount.blob.core.windows.net/rootmap-schemata-container/VolumeObjects.xsd">
  <construction>
    <owner>VolumeObjectCoordinator</owner>
	  <volumeobject>
      <class_name>BoundingRectangularPrism</class_name>
      <root_penetration_probability>
        <top>0.1</top>
        <bottom>1.0</bottom>
        <sides>0.0</sides>
        <probability_calculation_algorithm>Directly Specified</probability_calculation_algorithm>
      </root_penetration_probability>
      <permeability>
        <top>0.0</top>
        <bottom>0.0</bottom>
        <sides>0.0</sides>
      </permeability>
      <leftfronttop>1,5,12</leftfronttop>
      <rightbackbottom>12,20,16</rightbackbottom>
    </volumeobject>
  </construction>
</rootmap>
